Name,OpClass,OpScope,OpType,OpReturnType,OperatorFlag,OriginalVersion,CodeFirstAdded,CodeAltered,ChangeRefSet,OSVersion,NumberOfArgs,HasNeededArguments,IsDotOp,HasDotOpVersion,HasLoopVariable,HasRegExArgument,HasScopeArgument,HasConditionalArgument,HasOptionalArgument,HasStyledOutput,HonoursLinkType,HasNoCodeSample,Text,TextJa
list.containsAnyOf(regexList),Function,Item,Query Boolean,boolean test,false,8.8.0,Baseline,,,,1,true,true,false,false,true,false,false,false,false,,false,"list.containsAnyOf(regexList)\nThe operator .containsAnyOf(regexList) is true if any of the words in a set of words (i.e. a List- or Set-type list) is contained in the chained-to target string. As shown below, the list may have many or only one entry. The test is case-sensitive (previously it was case-insensitive). For example:\n	$MyBoolean = $MyList.containsAnyOf(""emulate""); \nWill be true if the tested note's $Text contains the word ""emulate""; unlike with .contains() or .icontains() a partial value may be matched in the target list. If $MyList holds the values 'emulate', 'mimic' and 'simulate', the list is tested as if a literal string, i.e. with the semi-colon delimiters present:\n	$MyBoolean = ""emulate;mimic;simulate"".containsAnyOf(""emulate""); \nA more applied example:\n	$MyBoolean = $MyList.containsAnyOf(wordsRelatedTo(""emulate"")); \nWill be true if the tested note's $MyList contains the word ""emulate"".\nregexList implies using a list of values (ideally with no dupes). This can be a literal list of 1 or more values—as in the example above, or an attribute reference holding a list of values, for instance:\n	$MyBoolean = $MyList.containsAnyOf($MySet); \nIt is important to note that .containsAnyOf() is always a case-sensitive test. Thus in the first example above, it will match ""emulate"" but not ""Emulate"" or any other case variant of the word.\nAlthough the examples above use whole words the list in regexList is actually processed assuming they are regular expressions (which may of course be literal strings). Thus in the first example above, it will match both ""emulate"" and ""emulated"" but not ""emulating"". The test value ""emulate\b"", expecting a word break after the final 'e' would this match ""emulate"" but not ""emulated"".\nFor a case-insensitive version if this operator see list.icontainsAnyOf().\nNote the slightly different behaviour from that when chaining a String.","list.containsAnyOf(regexList)\n演算子 .containsAnyOf(regexList) は、単語のセット (つまり、List 型または Set 型のリスト) 内のいずれかの単語が連鎖先のターゲット文字列に含まれている場合に true になります。以下に示すように、リストには多数のエントリが含まれる場合もあれば、1 つのエントリのみが含まれる場合もあります。テストでは大文字と小文字が区別されます (以前は大文字と小文字が区別されませんでした)。たとえば:\n$MyBoolean = $MyList.containsAnyOf(""エミュレート"");\nテストされたメモの $Text に「emulate」という単語が含まれている場合は true になります。.contains() や .icontains() とは異なり、部分的な値がターゲット リスト内で一致する可能性があります。$MyList が値「emulate」、「mimic」、および「simulate」を保持している場合、リストはリテラル文字列であるかのように、つまりセミコロン区切り文字が存在するかのようにテストされます。\n$MyBoolean = ""エミュレート;模倣;シミュレート"".containsAnyOf(""エミュレート"");\nより応用的な例:\n$MyBoolean = $MyList.containsAnyOf(wordsManyTo(""emulate""));\nテストされたノートの $MyList に「emulate」という単語が含まれている場合は true になります。\nregexList は、値のリスト (理想的には重複のないもの) を使用することを意味します。これは、上記の例のように 1 つ以上の値のリテラル リストにすることも、値のリストを保持する属性参照にすることもできます。次に例を示します。\n$MyBoolean = $MyList.containsAnyOf($MySet);\n.containsAnyOf() は常に大文字と小文字を区別するテストであることに注意することが重要です。したがって、上記の最初の例では、「エミュレート」には一致しますが、「エミュレート」やその他の大文字と小文字が異なる単語には一致しません。\n上記の例では単語全体が使用されていますが、regexList 内のリストは実際には正規表現 (もちろんリテラル文字列の場合もあります) であると想定して処理されます。したがって、上記の最初の例では、「エミュレート」と「エミュレートされた」の両方に一致しますが、「エミュレート」には一致しません。テスト値「emulate\b」は、最後の「e」の後に単語の区切りがあると予想されますが、これは「emulate」には一致しますが、「emulated」には一致しません。\nこの演算子の大文字と小文字を区別しないバージョンについては、list.icontainsAnyOf() を参照してください。\nString をチェーンする場合とは動作が若干異なることに注意してください。"
"list.count_if(loopVar, condition)",Function,Group,Data manipulation,Number,false,9.5.0,Baseline,,,,,true,false,false,true,false,false,true,false,false,,false,"list.count_if(loopVar, condition)\nThe dot-operator .count_if() counts the members of a List- or Set-type list that satisfy a condition. Each item in the list is bound in turn to loopVar, and if condition is met, then that item is added to the returned count.\nloopVar is essentially the same as the loop variable used by the List.each() operator. In the examples below, for clarity the loopVar value ""anItem"" is used, but as with any loop variable a shorter less expressive values such a ""x"" can be used (e.g. by more expert users).\nThe condition argument is a conditional expression for which each tested item must return true or false.\nFor example if $MyList is ""1;2;3;4;5"", then:\n	$MyListA =- $MyList.count_if(anItem, anItem>3) \nreturns 2, being the number of items in $MyList whose value is greater than 3. If $MyList is ""1;1;2;2;3;3;4;4;5;5"", then:\n	$MyListA =- $MyList.count_if(anItem, anItem>3) \nreturns 4, being the number of items in $MyList whose value is greater than 3 and values '4' and '5' each occur twice.\nlist.count_if() vs. .count_if()\nAlthough the two appear similar. This operator works directly on the source list values, whereas count_if() creates a list of $Path values and returns on an attribute value from each of those paths (where the item at the $Path meets the condition).","list.count_if(ループ変数、条件)\nドット演算子 .count_if() は、条件を満たす List 型または Set 型のリストのメンバーをカウントします。リスト内の各項目は、loopVar に順番にバインドされ、条件が満たされると、その項目が返されたカウントに追加されます。\nloopVar は、List.each() 演算子で使用されるループ変数と本質的に同じです。以下の例では、わかりやすくするために、loopVar 値「anItem」が使用されていますが、他のループ変数と同様に、「x」などのより短く表現力の低い値も使用できます (たとえば、より専門的なユーザーによって)。\n条件引数は、テストされた各項目が true または false を返す必要がある条件式です。\nたとえば、$MyList が ""1;2;3;4;5"" の場合、次のようになります。\n$MyListA =- $MyList.count_if(anItem, anItem>3)\n$MyList 内の値が 3 より大きい項目の数である 2 を返します。$MyList が ""1;1;2;2;3;3;4;4;5;5"" の場合、次のようになります。\n$MyListA =- $MyList.count_if(anItem, anItem>3)\n$MyList 内の値が 3 より大きい項目の数である 4 を返します。値 '4' と '5' はそれぞれ 2 回出現します。\nlist.count_if() と .count_if()\n両者は似ているように見えますが。この演算子はソース リストの値に直接作用しますが、count_if() は $Path 値のリストを作成し、それらの各パスからの属性値 ($Path の項目が条件を満たす場合) を返します。"
list.count(),Property,List,Data manipulation,Number,false,7.0.0,Baseline,,,,,false,true,false,false,false,false,false,false,false,,false,"list.count()\nlist.count\nThe property .count counts the Number of discrete items in the specified List- or Set-type list.\nThis is better used instead of count(list) or list.size.\nThe subject list is evaluated so can use a literal list or $attribute(note). It can also use more complex expressions to get data as long as the result is an attribute of the List or Set data type.\nFor example if $DisplayedAttributes for the current note is ""Color;AccentColor;NameFont"" then the code\n	$MyNumber = $DisplayedAttributes.count; \nis effectively\n	$MyNumber = (""Color;AccentColor;NameFont"").count; \nand not surprisingly returns 3. Note that the count is not all unique values for the attribute across the whole TBX; scope is restricted to 'this' note or another nominated note. Specimen usage:\n	$MyNumber = $DisplayedAttributes.count; \n	$MyNumber = $DisplayedAttributes(""some other note"").count; \nTo use .count with a list of items that are attributes or expressions, use list() to pre-create a list:\n	Works: $MyNumber = list(4+2,9+6).count; (output: 2)\nFor more complex examples, where list items are action code expressions, it may be necessary to use eval() to wrap each list item expression e.g. list(eval(expressionA),eval(expressionB)).\nExamples\nThe following is a trivial example (given you could use $ChildCount instead) but shows how count can be used in a more subtle way:\n	$MyNumber = collect(children,$Name).count; \nThe result of collect() is a List, in this case a number of note titles. List.count will return the number of values in the list (including duplicates). To get a de-duped count, chain the .unique function before the .count:\n	$MyNumber = collect(children,$Name).unique.count; \nSimilarly, find() returns a List but note that find() does not de-dupe for aliases. Thus test $IsAlias in the query to weed alias results from the returned list:\n	$MyNumber = find($Prototype==""pProject""&$IsAlias==false&$ChildCount>1).count;","list.count()\nリストカウント\nプロパティ .count は、指定されたリスト型リストまたはセット型リスト内の個別の項目の数をカウントします。\nこれは、count(list) や list.size の代わりに使用することをお勧めします。\n件名リストが評価されるため、リテラル リストまたは $attribute(note) を使用できます。結果が List または Set データ型の属性である限り、より複雑な式を使用してデータを取得することもできます。\nたとえば、現在のノートの $DisplayedAttributes が「Color;AccentColor;NameFont」の場合、コードは次のようになります。\n$MyNumber = $DisplayedAttributes.count;\n効果的には\n$MyNumber = (""カラー;アクセントカラー;名前フォント"").count;\n当然のことながら、3 が返されます。カウントは、TBX 全体にわたる属性のすべての一意の値ではないことに注意してください。範囲は「この」ノートまたは指定された別のノートに制限されます。検体の使用:\n$MyNumber = $DisplayedAttributes.count;\n$MyNumber = $DisplayedAttributes(""他のメモ"").count;\n属性または式である項目のリストで .count を使用するには、 list() を使用してリストを事前に作成します。\n動作: $MyNumber = list(4+2,9+6).count;(出力:2)\nリスト項目がアクション コード式であるより複雑な例では、 eval() を使用して各リスト項目式をラップする必要がある場合があります。list(eval(式A),eval(式B))。\n例\n以下は簡単な例 (代わりに $ChildCount を使用できることを前提としています) ですが、より巧妙な方法で count を使用する方法を示しています。\n$MyNumber =collect(children,$Name).count;\ncollect() の結果はリストであり、この場合はメモのタイトルの数です。List.count は、リスト内の値の数 (重複を含む) を返します。重複排除されたカウントを取得するには、.count の前に .unique 関数を連鎖させます。\n$MyNumber =collect(children,$Name).unique.count;\n同様に、find() は List を返しますが、find() はエイリアスの重複を除外しないことに注意してください。したがって、クエリで $IsAlias をテストして、返されたリストからエイリアスの結果を取り除きます。\n$MyNumber = find($Prototype==""pProject""&$IsAlias==false&$ChildCount>1).count;"
list.countOccurrencesOf(literalStr),Function,List,Data manipulation,Number,false,9.1.0,Baseline,,,,1,true,true,false,false,false,false,false,false,false,,false,"list.countOccurrencesOf(literalStr)\nThis function returns the Number of times that the literal string literalStr appears in the source List- or Set-type list. A string of the attribute's raw concatenated list values (i.e. with semicolon delimiters) is tested.\nIf $MyList contains ""ant;bee;ant;cow;ant"", then:\n	$MyNumber = $MyList.countOccurrencesOf(""ant""); returns 3\nSets de-duplicate, but partial matches of Sets do not. If $MySet contains ""cat;cut;hat;hit;hut;pat;sat"", then\n	$MyNumber = $MySet.countOccurrencesOf(""at""); returns 4\nliteralStr is literal and must not be a regular expression. If the latter is needed use list.contains() or list.icontains().","list.countOccurrencesOf(literalStr)\nこの関数は、リテラル文字列 literalStr がソースのリスト型リストまたはセット型リストに出現する回数を返します。属性の生の連結リスト値の文字列 (つまり、セミコロン区切り文字を含む) がテストされます。\n$MyList に「ant;bee;ant;cow;ant」が含まれる場合、次のようになります。\n$MyNumber = $MyList.countOccurrencesOf(""ant"");3を返します\nセットは重複排除されますが、セットの部分一致は重複排除されません。$MySet に ""cat;cut;hat;hit;hut;pat;sat"" が含まれる場合、\n$MyNumber = $MySet.countOccurrencesOf(""at"");4を返します\nliteralStr はリテラルであり、正規表現であってはなりません。後者が必要な場合は、list.contains() または list.icontains() を使用します。"
list.each(loopVar){actions},Function,Item,Data manipulation,iterator,false,5.10.0,Baseline,,,,1,true,true,false,true,false,false,false,false,false,,false,"list.each(loopVar){ action(s) }\nThis allows you to operate in turn on each item in a List- or Set-type list. Put another way you 'iterate;' or loop though, every item in the list evaluating any code inside the { } brackets. The user-defined (i..e. named by the user) loopVar can be used inside the loop to refer to the value of the current list item value being iterated. If the list is a list of path info (or $IDString, $ID, or unique $Name) then in-loop loopVar can be used for offset addressing the note at that path via an attribute offset argument, i.e. $SomeAttribute(loopVar).\nWhat is a loop variable?\nFor example, for a note with a list of values in $MyList:\n	$MyList.each(x){$Result=$Result +x+""\n"" ;} \nwill replace the current note's value of $Result with a list of every value from $MyList, but each on its own line. The loopVar, here the in-loop variable 'x', is simply the string defined in .each(), and is case-sensitive and a '$' prefix is not required for in-loop references to the loop variable. For most Tinderbox users, a more readable/understandable version of the above is this:\n	$MyList.each(aString){\n		$Result=$Result +aString+""\n"" ;\n	}\nWhat has changed? Firstly, the loop has been broken out onto speaker lines and in-loop code indented. Tinderbox ignores line breaks and white space between operators and values so both the above seems the same to the parser. Secondly, the obfuscatory 'x' loopVar name has been changed to a more descriptive 'aString' based on the presumption that $Result is a String (it cannot be a Number because Number-type data cannot have line breaks within a single value) and, for the calling note, we are compiling a string the list $Result values. \nThus .each(loopVar) would iterate using references to loopVar, and thus .each(Y) would iterate using references to 'Y', whilst .each(Abracadabra) would iterate using references to 'Abracadabra', and so forth. Consider making the loop variable something clear to both the user and to Tinderbox. In the trivial example above, 'x' seems pretty clear but might be misread by the users—in a mathematical context—as a multiplication symbol; Tinderbox will not be confused as it uses * for multiplication but consider how something like 'LoopVar' might be clearer. By the same token make sure the loop variable name does not clash with existing attribute names or attribute string values of the same name that might be used as part of the data being processed.\nA variable declared using var() may be altered from within the scope of an .each() loop.\nIf $Total is a numeric attribute and $MyList is a list of numbers:\n	$TotalNumber=0;\n	$MyList.each(aNumber){\n		$TotalNumber += aNumber*aNumber; // parentheses not required but can be useful if calculation is not simple\n	} \ncomputes the sum of the squares of the values in $MyList and stored it in $TotalNumber. As the list is a list of numbers, the user-chosen loopVar name used is 'aNumber'.\nNote: remember that you, the user, choose the actual name of loopVar in your own code. It can vary per use, as in the examples on this page.\nThe loopVar can be a path and this can be used as a variable designator for attribute offset addressing inside the loop:\n	$Text="""";\n	collect(children,$Path).each(aPath){ \n		$Text += ""\n""+$Text(aPath);\n	}\nIn the above, a list is created on the fly of the current note's children. Then the current note's $Text is appended, for each child, with a line and the child's $Text. As the list is a list of paths, the user-chosen loopVar name used is 'aPath'. Thus for each iteration of the loop aPath's value is being used to provide the offset address in the loop to $Text(loopVar).\nIf it is desired to iterate a list a particular number of times, another approach to the above is to use the range '...' operator which can be used to provide a numbered loop variable (see).\nAfter each iteration of an each(){} loop, accumulated back-references are cleared. Formerly, back-references from each iteration were retained for the lifetime of the loop, making it very difficult to retrieve the desired reference.\nTo test for position in a loop, i.e. detecting if processing the first or last items, see list.first() and list.last().\nTo get a random item from a list without needing to use a loop, see list.randomItem().\nA worked example of looping is here.\nExamples of using action() within a loop to create attribute references is given here.","list.each(loopVar){ アクション }\nこれにより、リスト型またはセット型のリスト内の各項目を順番に操作できます。別の言い方をすると、「反復」します。ただし、ループでは、リスト内のすべての項目が { } 括弧内のコードを評価します。ユーザー定義 (つまり、ユーザーが名前を付けた) ループ変数をループ内で使用して、反復されている現在のリスト項目値の値を参照できます。リストがパス情報 (または $IDString、$ID、または一意の $Name) のリストである場合、ループ内ループ Var を使用して、属性オフセット引数 (つまり、$SomeAttribute(loopVar)) を介してそのパスにあるメモをアドレス指定するオフセットに使用できます。\nループ変数とは何ですか?\nたとえば、$MyList に値のリストが含まれるメモの場合:\n$MyList.each(x){$Result=$Result +x+""\n"" ;}\n現在のメモの $Result の値を $MyList のすべての値のリストに置き換えますが、それぞれが別の行に表示されます。ここでは、loopVar (ループ内変数 'x') は .each() で定義された単なる文字列であり、大文字と小文字が区別され、ループ変数へのループ内参照には '$' プレフィックスは必要ありません。ほとんどの Tinderbox ユーザーにとって、上記のより読みやすく理解しやすいバージョンは次のとおりです。\n$MyList.each(aString){\n$Result=$Result +aString+""\n"" ;\n}\n何が変わったのでしょうか？まず、ループがスピーカー回線に分割され、ループ内コードがインデントされています。Tinderbox は演算子と値の間の改行と空白を無視するため、パーサーには上記の両方が同じように見えます。次に、難読な 'x' ループ変数名が、$Result が文字列であるという前提に基づいて、より説明的な 'aString' に変更されました (数値型データは単一の値内に改行を含めることができないため、数値にすることはできません)。また、呼び出し元のメモとして、$Result 値のリストの文字列をコンパイルしています。\nしたがって、.each(loopVar) は、loopVar への参照を使用して反復し、したがって、.each(Y) は、「Y」への参照を使用して反復し、.each(Abracadabra) は、「Abracadabra」への参照を使用して反復します。ループ変数をユーザーと Tinderbox の両方にとって明確なものにすることを検討してください。上の簡単な例では、「x」は非常に明確に見えますが、数学的な文脈において、乗算記号としてユーザーに誤って読み取られる可能性があります。Tinderbox は乗算に * を使用するため混乱することはありませんが、「LoopVar」のようなものの方が明確であることを考慮してください。同様に、ループ変数名が、処理されるデータの一部として使用される可能性のある既存の属性名または同じ名前の属性文字列値と衝突しないことを確認してください。\nvar() を使用して宣言された変数は、.each() ループのスコープ内から変更できます。\n$Total が数値属性で、$MyList が数値のリストの場合:\n$TotalNumber=0;\n$MyList.each(aNumber){\n$TotalNumber += aNumber*aNumber;// 括弧は必須ではありませんが、計算が単純でない場合に便利です\n}\n$MyList 内の値の二乗和を計算し、$TotalNumber に保存します。リストは数値のリストであるため、使用されるユーザーが選択したloopVar名は「aNumber」です。\n注: ユーザーであるあなたが、独自のコード内で、loopVar の実際の名前を選択することに注意してください。このページの例のように、用途によって異なる場合があります。\nloopVar はパスにすることができ、これをループ内の属性オフセット アドレス指定の変数指定子として使用できます。\n$Text="""";\ncollect(children,$Path).each(aPath){\n$Text += ""\n""+$Text(aPath);\n}\n上記では、現在のノートの子のリストがその場で作成されます。次に、現在のノートの $Text に、子ごとに行と子の $Text が追加されます。リストはパスのリストであるため、使用されるユーザーが選択したloopVar名は「aPath」です。したがって、ループの反復ごとに、aPath の値を使用して、ループ内のオフセット アドレスが $Text(loopVar) に提供されます。\nリストを特定の回数だけ反復する必要がある場合、上記に対する別のアプローチは、番号付きループ変数を提供するために使用できる範囲 '...' 演算子を使用することです (参照)。\neach(){} ループの各反復の後、蓄積された後方参照はクリアされます。以前は、各反復からの逆参照はループの存続期間中保持されていたため、目的の参照を取得することが非常に困難でした。\nループ内の位置をテストするには、つまり最初の項目を処理するか最後の項目を処理するかを検出するには、list.first() と list.last() を参照してください。\nループを使用せずにリストからランダムな項目を取得するには、list.randomItem() を参照してください。\nループの実際の例はここにあります。\nここでは、ループ内で action() を使用して属性参照を作成する例を示します。"
