Name,OpClass,OpScope,OpType,OpReturnType,OperatorFlag,OriginalVersion,CodeFirstAdded,CodeAltered,ChangeRefSet,OSVersion,NumberOfArgs,HasNeededArguments,IsDotOp,HasDotOpVersion,HasLoopVariable,HasRegExArgument,HasScopeArgument,HasConditionalArgument,HasOptionalArgument,HasStyledOutput,HonoursLinkType,HasNoCodeSample,Text,TextJa
"String.captureTo(matchStr[, targetAttributeStr])",Function,Item,Stream parsing,String,false,9.1.0,Baseline,,,,2,true,true,false,false,true,false,false,true,false,,false,"String.captureTo(matchStr, targetAttributeStr)\nString.captureTo(matchStr)\nStores the source text string up to, but not including, the designated literal matchStr into the specified targetAttributeStr, a quoted name of an attribute,  and returns the string that follows matchStr. Note that matchStr is not a regular expression and can only be a literal string.\nIf the targetAttributeStr is omitted the String is advanced to the end so processing ceases.\nThe value given for targetAttributeSt can be:\n* a quoted literal string, e.g. (""Text"") for $Text. \n* an unquoted variable/loopVariable, e.g. (vString) for a variable 'vString'.\nFor example, if the stream is ""Piglet, a friend of Pooh"" and if wishing to capture only the name 'Piglet' into $SomeAttribute:\n	$Result = $Text.captureTo("", "",""SomeAttribute""); \nNow, the value of $Result is ""a friend of Pooh"" and that of $SomeAttribute is ""Piglet"".","String.captureTo(matchStr, targetAttributeStr)\nString.captureTo(matchStr)\n指定されたリテラル matchStr までのソース テキスト文字列を、指定された targetAttributeStr (属性の引用符で囲まれた名前) に格納し、matchStr に続く文字列を返します。matchStr は正規表現ではなく、リテラル文字列のみであることに注意してください。\ntargetAttributeStr が省略された場合、文字列は最後まで進められるため、処理は停止します。\ntargetAttributeSt に指定できる値は次のとおりです。\n* 引用符で囲まれたリテラル文字列、例:(""テキスト"") $Text の場合。\n* 引用符で囲まれていない変数/ループ変数。例:(vString) 変数「vString」の場合。\nたとえば、ストリームが「プーさんの友達のピグレット」で、「ピグレット」という名前だけを $SomeAttribute にキャプチャしたい場合は、次のようになります。\n$Result = $Text.captureTo("", "",""SomeAttribute"");\nここで、$Result の値は「プーさんの友達」、$SomeAttribute の値は「Piglet」です。"
String.captureToken([targetAttributeStr]),Function,Item,Stream parsing,String,false,9.1.0,Baseline,,,,1,false,true,false,false,false,false,false,true,false,,false,"String.captureToken(targetAttributeStr)\nString.captureToken()\nString.captureToken\nCaptures a sequence of non-whitespace characters ('tokens'), the matched token string is passed to the specified targetAttributeStr, a quoted name of an attribute. The String stream is not advanced and any chained parsing continues from the same point. Punctuation (notably @) is part of a token but *not* part of a word.\nIf the targetAttributeStr is omitted the String is advanced to the end so processing ceases.\nThe value given for targetAttributeSt can be:\n* a quoted literal string, e.g. (""Text"") for $Text. \n* an unquoted variable/loopVariable, e.g. (vString) for a variable 'vString'.\nFor example, with a source a stream of ""5. Hello world"":\n	vString = $Text.captureToken(""SomeAttribute""); \nresults in attribute $SomeAttribute holding ""5."" and the variable vText hosing the value "" Hello world""—note the space after the full stop is passed to the text stream as it is not a captured 'token'.\nIif the source stream is ""John Doe&lt;johndoe@example.com>"":\n	vText = $Text.captureToken(vString) \nresults in variable vText holding "" Doe&lt;johndoe@example.com>"" whilst variable vString holds ""John"".\nThus .captureToken() might be considered akin to a more permissive form of String.captureWord() where the first 'word' in the stream contains non-normal word characters (as long as not a space).","String.captureToken(targetAttributeStr)\nString.captureToken()\nString.captureToken\n一連の非空白文字 (「トークン」) をキャプチャし、一致したトークン文字列が、指定された targetAttributeStr (引用符で囲まれた属性の名前) に渡されます。String ストリームは進められず、連鎖解析は同じポイントから続行されます。句読点 (特に @) はトークンの一部ですが、単語の一部ではありません。\ntargetAttributeStr が省略された場合、文字列は最後まで進められるため、処理は停止します。\ntargetAttributeSt に指定できる値は次のとおりです。\n* 引用符で囲まれたリテラル文字列、例:(""テキスト"") $Text の場合。\n* 引用符で囲まれていない変数/ループ変数。例:(vString) 変数「vString」の場合。\nたとえば、ソースが「5. Hello world」のストリームの場合:\nvString = $Text.captureToken(""SomeAttribute"");\nその結果、属性 $SomeAttribute は「5」を保持します。値「Hello world」を格納する変数 vText。キャプチャされた「トークン」ではないため、ピリオドの後のスペースがテキスト ストリームに渡されることに注意してください。\nソース ストリームが「John Doe<johndoe@example.com>」の場合:\nvText = $Text.captureToken(vString)\nその結果、変数 vText は「Doe<johndoe@example.com>」を保持し、変数 vString は「John」を保持します。\nしたがって、 .captureToken() は、ストリーム内の最初の「単語」に (スペースでない限り) 非通常の単語文字が含まれる、より寛容な形式の String.captureWord() に似ていると考えることができます。"
String.captureWord([targetAttributeStr]),Function,Item,Stream parsing,String,false,9.1.0,Baseline,,,,1,false,true,false,false,false,false,false,true,false,,false,"String.captureWord(targetAttributeStr)\nString.captureWord()\nString.captureWord\nMatches a word character at the start of String up to the first non-word character and stores the word in the specified targetAttributeStr, a quoted name of an attribute, and returns the string that follows this word. Fails if the string is empty or entirely white space.\nWhat constitutes a word? This operator captures text from the current position up to (but not including) the next character that is a digit, whitespace, or punctuation.\nIf the targetAttributeStr is omitted the String is advanced to the end so processing ceases.\nThe value given for targetAttributeSt can be:\n* a quoted literal string, e.g. (""Text"") for $Text. \n* an unquoted variable/loopVariable, e.g. (vString) for a variable 'vString'.\nFor example, if the stream is ""Hello world"":\n	vString = $Text.captureWord(""SomeAttribute""); \nresults in attribute $SomeAttribute holding the value ""Hello"" and the variable vText holding the value "" world"". If the stream does not start with a word, the operator fails. So, for a stream of ""5. Hello world"":\n	vString = $Text.captureWord(""SomeAttribute""); \nresults in attribute $SomeAttribute holding no value and the variable vString hosing the value ""5. Hello world"".","String.captureWord(targetAttributeStr)\nString.captureWord()\nString.captureWord\nString の先頭にある単語文字を最初の単語以外の文字まで照合し、その単語を指定された targetAttributeStr (引用符で囲まれた属性の名前) に格納し、この単語に続く文字列を返します。文字列が空か完全に空白の場合は失敗します。\n単語を構成するものは何ですか?この演算子は、現在の位置から次の文字 (数字、空白、または句読点) までのテキストをキャプチャします。\ntargetAttributeStr が省略された場合、文字列は最後まで進められるため、処理は停止します。\ntargetAttributeSt に指定できる値は次のとおりです。\n* 引用符で囲まれたリテラル文字列、例:(""テキスト"") $Text の場合。\n* 引用符で囲まれていない変数/ループ変数。例:(vString) 変数「vString」の場合。\nたとえば、ストリームが「Hello world」の場合:\nvString = $Text.captureWord(""SomeAttribute"");\nその結果、属性 $SomeAttribute には値「Hello」が保持され、変数 vText には値「world」が保持されます。ストリームが単語で始まらない場合、オペレーターは失敗します。したがって、「5. Hello world」のストリームの場合は次のようになります。\nvString = $Text.captureWord(""SomeAttribute"");\nその結果、属性 $SomeAttribute には値が保持されず、変数 vString には値「5. Hello world」が保持されます。"
String.captureXML(),Operator,Item,Stream parsing,,false,9.1.0,,,,,,false,true,false,false,false,false,false,false,false,,false,"String.captureXML()\nString.captureXML\nAttempts to parse the string as fully/partially XML and fails if unsuccessful. The parsed XML is saved as the current XML (stream) object. \nEssentially, this re-scopes the current stream so that it contains only the contents of the first section of XML detected within the original stream. The focus of the stream parsing is set to the beginning of the extracted XML code.\nOnly one XML object may be current at any time. If the source stream contains multiple discrete XML code sections, only the first is detected/used.",String.captureXML()\nString.captureXML\n文字列を完全または部分的に XML として解析しようとしますが、失敗すると失敗します。解析された XML は、現在の XML (ストリーム) オブジェクトとして保存されます。\n基本的に、これにより現在のストリームのスコープが変更され、元のストリーム内で検出された XML の最初のセクションの内容のみが含まれるようになります。ストリーム解析のフォーカスは、抽出された XML コードの先頭に設定されます。\n常に 1 つの XML オブジェクトのみが最新になります。ソース ストリームに複数の個別の XML コード セクションが含まれている場合、最初のコード セクションのみが検出/使用されます。
String.contains(regexStr),Function,Item,Query Boolean,boolean test,false,5.7.0,Baseline,,,,1,true,true,false,false,true,false,false,false,false,,false,"String.contains(regexStr)\nThis operator tests whether regular expression pattern regexStr matches the referenced string attribute's value in whole or part. Matches are always case-sensitive, unlike String.icontains(). The match gives a coerced boolean result: if regexStr is matched (literally or via regex) the function returns the match offset+1 in the source string, where offset is the distance from the start of the string to the start of the matched regex. No match, coerces to false. The +1 works around the fact the match is zero-based, so a match at position 0 (the start of the string), returns as 1 (0+1) and a value of 1 or more coerces to a boolean true. The boolean allows queries' normal true/false to evaluate as normal.\nIf concerned over unwanted case-sensitivity, use String.icontains() which is always case-insensitive.\nregexStr is one of:\n* an unquoted action code expression, which includes just referencing a single attribute name e.g. MyString\n* a quoted string; quoted strings may be either:\n** a literal string (i.e. actual text)\n** a regular expression.\nImportant: do not omit the enclosing quotes for literal strings or regex. If omitted, Tinderbox will try to evaluate the string as an expression. Doing this may result in the expected result but this is actually a false positive. So, remember to enclose your regex or literals in quotes.\nFor example:\n	$MyString.contains(""regex"") \nis true if $MyString matches regexStr's pattern. Other more complex usage:\n	$MyString.contains($MyMatchText) \n	$MyString.contains($MyString(agent)) \n	$MyString(parent).contains(""Tuesday"") \n	""Any day like Saturday is good"".contains($MyDay) \n	""Any day like Saturday is good"".contains(""Saturday"") \nNote that regex/literal strings are quoted whilst action expressions are not.\nGetting the offset of the (first) regex match\nIf the regular expression regexStr is found the function returns the match offset+1, where offset is the distance from the start of the string to the start of the matched regex. If there is more than one match, the offset of the first match is returned. Formerly, .contains() returned true if the regex was found. The '+1' modifier ensures that a match at position zero return a number higher than zero which would otherwise coerce tofalse. Since 1+offset is always true, no changes are required in existing documents but the function also gives usable offset information. Thus, if $MyString is ""abcdefgehEi"":\n	$MyNumber = $MyString.contains(""e""); returns 5.\n	$MyNumber = $MyString.contains(""E""); returns 10.\n	$MyNumber = $MyString.contains(""eh""); returns 8.\nTesting ""does not contain""\nUse a ! prefix to the query argument:\n	!$MyString.contains(""Tuesday"") \nUse of parentheses around the negated query term, can assist Tinderbox's parsing:\n	(!$MyString.contains(""Tuesday"")) \nUsing back-references\nIn an agent query or if() conditions the function can return back-references to matches of (sub-)strings.\nString.contains() clears the list of back references from previous processes, so $0 and $1 correspond to its own results, not those from prior expressions.\nDealing with inline quote characters\nBecause regex is parsed for regular expressions, it may be possible to use the '\xNN' form described here to work around the lack of escaping from single double quotes within strings.\nLegacy format\nThis operator is the replacement of the older form of AttributeName(regex) which is deprecated and should not be used in new work (legacy support may fall away). Apart from anything else, the current syntax should remove the confusion over whether/when to use the $ prefix with attribute names in queries.","String.contains(regexStr)\nこの演算子は、正規表現パターン regexStr が、参照された文字列属性の値の全体または一部と一致するかどうかをテストします。String.icontains() とは異なり、一致では常に大文字と小文字が区別されます。一致により、強制されたブール値の結果が得られます。regexStr が (リテラルまたは正規表現経由で) 一致した場合、関数はソース文字列内の一致オフセット + 1 を返します。ここで、オフセットは文字列の先頭から一致した正規表現の先頭までの距離です。一致しないため、強制的に false に設定されます。+1 は、一致が 0 ベースであるという事実を回避するため、位置 0 (文字列の先頭) での一致は 1 (0+1) として返され、1 以上の値はブール値 true に強制されます。ブール値を使用すると、クエリの通常の true/false を通常どおり評価できます。\n不要な大文字と小文字の区別が気になる場合は、常に大文字と小文字を区別しない String.icontains() を使用してください。\nregexStr は次のいずれかです。\n* 引用符で囲まれていないアクション コード式。これには、単一の属性名を参照するだけが含まれます。MyString\n* 引用符で囲まれた文字列;引用符で囲まれた文字列は次のいずれかになります。\n** リテラル文字列 (つまり、実際のテキスト)\n** 正規表現。\n重要: リテラル文字列または正規表現を囲む引用符を省略しないでください。省略した場合、Tinderbox は文字列を式として評価しようとします。これを実行すると期待どおりの結果が得られる可能性がありますが、これは実際には誤検知です。したがって、正規表現またはリテラルを引用符で囲むことを忘れないでください。\nたとえば:\n$MyString.contains(""正規表現"")\n$MyString が regexStr のパターンと一致する場合は true です。その他のより複雑な使用法:\n$MyString.contains($MyMatchText)\n$MyString.contains($MyString(エージェント))\n$MyString(parent).contains(""火曜日"")\n「土曜日などいつでも良いです」.contains($MyDay)\n「土曜日のような日が良いです。」.contains(""土曜日"")\n正規表現/リテラル文字列は引用符で囲まれますが、アクション式は引用符で囲まれないことに注意してください。\n(最初の) 正規表現一致のオフセットの取得\n正規表現 regexStr が見つかった場合、関数は一致の offset+1 を返します。ここで、offset は文字列の先頭から一致した正規表現の先頭までの距離です。複数の一致がある場合は、最初の一致のオフセットが返されます。以前は、正規表現が見つかった場合、 .contains() は true を返しました。「+1」修飾子を使用すると、位置 0 での一致により、そうでない場合は強制的に false となる、0 より大きい数値が返されることが保証されます。1+offset は常に true であるため、既存のドキュメントを変更する必要はありませんが、この関数は使用可能なオフセット情報も提供します。したがって、$MyString が「abcdefgehEi」の場合:\n$MyNumber = $MyString.contains(""e"");5を返します。\n$MyNumber = $MyString.contains(""E"");10を返します。\n$MyNumber = $MyString.contains(""eh"");8を返します。\n「を含まない」テスト\n! を使用してください。クエリ引数の接頭辞:\n!$MyString.contains(""火曜日"")\n否定されたクエリ用語を括弧で囲むと、Tinderbox の解析が容易になります。\n(!$MyString.contains(""火曜日""))\n後方参照の使用\nエージェント クエリまたは if() 条件では、関数は一致する (サブ) 文字列への逆参照を返すことができます。\nString.contains() は前のプロセスからの後方参照のリストをクリアするため、$0 と $1 は前の式の結果ではなく、独自の結果に対応します。\nインライン引用符の扱い\nregex は正規表現として解析されるため、ここで説明する「\xNN」形式を使用して、文字列内の単一二重引用符からエスケープできない問題を回避できる可能性があります。\nレガシー形式\nこの演算子は、廃止された古い形式の AttributeName(regex) を置き換えるものであり、新しい作業では使用しないでください (レガシー サポートは廃止される可能性があります)。他のことは別として、現在の構文では、クエリ内の属性名に $ プレフィックスを使用するかどうか、またはいつ使用するかについての混乱が解消されるはずです。"
String.containsAnyOf(regexList),Function,List,Query Boolean,boolean test,false,8.9.0,Baseline,,,,1,true,true,false,false,true,false,false,false,false,,false,"String.containsAnyOf(regexList)\nThe operator .containsAnyOf(regexList) is true if any of the words in a set of words (i.e. list) is contained in the chained-to target string. As shown below, the list may have only one entry. The test is case-sensitive (previously it was case-insensitive). For example:\n	$MyBoolean = $Text.containsAnyOf(""emulate""); \nWill be true if the tested note's $Text contains the word ""emulate"". A more applied example:\n	$MyBoolean = $Text.containsAnyOf(wordsRelatedTo(""emulate"")); \nWill be true if the tested note's $Text contains the word ""aspire"".\nregexList implies using a list of values (ideally with no dupes). This can be a literal list of 1 or more values—as in the example above, or an attribute reference holding a list of values, for instance:\n	$MyBoolean = $Text.containsAnyOf($MySet); \nIt is important to note that .containsAnyOf() is always a case-insensitive test. Thus in the first example above, it will match ""emulate"" but not ""Emulate"" or any other case variant of the word.\nAlthough the examples above use whole words the list in regexList is actually processed assuming they are regular expressions (which may of course be literal strings). Thus in the first example above, it will match both ""emulate"" and ""emulated"" but not ""emulating"". The test value ""emulate\b"", expecting a word break after the final 'e' would this match ""emulate"" but not ""emulated"".\nFor a case-insensitive version of this operator see String.icontainsAnyOf().\nIf wishing to test a List or Set, chain to list.asString():\n	$MyBoolean = $MyList.asString.containsAnyOf(wordsRelatedTo(""emulate""));","String.containsAnyOf(regexList)\n演算子 .containsAnyOf(regexList) は、単語のセット (つまりリスト) 内のいずれかの単語が連鎖先のターゲット文字列に含まれている場合に true になります。以下に示すように、リストにはエントリが 1 つだけ含まれる場合があります。テストでは大文字と小文字が区別されます (以前は大文字と小文字が区別されませんでした)。たとえば:\n$MyBoolean = $Text.containsAnyOf(""エミュレート"");\nテストされたメモの $Text に「emulate」という単語が含まれている場合は true になります。より応用的な例:\n$MyBoolean = $Text.containsAnyOf(wordsManyTo(""emulate""));\nテストされたメモの $Text に「aspire」という単語が含まれている場合は true になります。\nregexList は、値のリスト (理想的には重複のないもの) を使用することを意味します。これは、上記の例のように 1 つ以上の値のリテラル リストにすることも、値のリストを保持する属性参照にすることもできます。次に例を示します。\n$MyBoolean = $Text.containsAnyOf($MySet);\n.containsAnyOf() は常に大文字と小文字を区別しないテストであることに注意することが重要です。したがって、上記の最初の例では、「エミュレート」には一致しますが、「エミュレート」やその他の大文字と小文字が異なる単語には一致しません。\n上記の例では単語全体が使用されていますが、regexList 内のリストは実際には正規表現 (もちろんリテラル文字列の場合もあります) であると想定して処理されます。したがって、上記の最初の例では、「エミュレート」と「エミュレートされた」の両方に一致しますが、「エミュレート」には一致しません。テスト値「emulate\b」は、最後の「e」の後に単語の区切りがあると予想されますが、これは「emulate」には一致しますが、「emulated」には一致しません。\nこの演算子の大文字と小文字を区別しないバージョンについては、String.icontainsAnyOf() を参照してください。\nList または Set をテストしたい場合は、list.asString() にチェーンします。\n$MyBoolean = $MyList.asString.containsAnyOf(wordsManyTo(""emulate""));"
String.countOccurrencesOf(literalStr),Function,Item,Data manipulation,Number,false,6.5.0,Baseline,,,,1,true,true,false,false,false,false,false,false,false,,false,"String.countOccurrencesOf(literalStr)\nThis function returns the Number of times that the literal argument 'literalStr' appears in the String. If $MyString contains the word ""aardvark"", then:\n	$MyNumber = $MyString.countOccurrencesOf(""a""); returns 3\n	$MyNumber = $MyString.countOccurrencesOf(""aa""); returns 1\n	$MyNumber = $MyString.countOccurrencesOf(""r""); returns 2\nliteralStr is literal and must not be a regular expression. If the latter is needed use String.contains() or String.icontains().","String.countOccurrencesOf(literalStr)\nこの関数は、リテラル引数 'literalStr' が文字列内に出現する回数を返します。$MyString に「ツチブタ」という単語が含まれている場合、次のようになります。\n$MyNumber = $MyString.countOccurrencesOf(""a"");3を返します\n$MyNumber = $MyString.countOccurrencesOf(""aa"");1を返します\n$MyNumber = $MyString.countOccurrencesOf(""r"");2を返します\nliteralStr はリテラルであり、正規表現であってはなりません。後者が必要な場合は、String.contains() または String.icontains() を使用します。"
